product_id,product_name,description,price,image,category_id
2000000,organization,Responsibility able vote strong science hair. Lay suddenly stay traditional magazine catch painting. Poor within seek base generation address. Bill wonder treatment writer.,86.32153993724569,product_2000000.jpg,3006
2000001,free,"Personal part his color site trouble. Consider central sport who result kind. Budget us second majority positive force.
At moment can image against.",23.120611569024742,product_2000001.jpg,3000
2000002,soldier,"Your analysis might left money effort. City board pressure coach color generation number understand. Past off analysis.
Factor generation public go effect nature away. Walk note mind rule serve be.",72.21017526411745,product_2000002.jpg,3009
2000003,land,"Order national little be these laugh her. Despite science form kind whose. None area town know.
Do every know stage rate.",76.16353462135271,product_2000003.jpg,3000
2000004,one,Will something why range current attorney trial form. Watch buy continue list just night glass.,39.05062821126961,product_2000004.jpg,3010
2000005,important,Indeed worker discuss blue hospital range simply every. Nation onto push personal lead behind federal. Marriage fight hospital under raise policy.,51.88877622205135,product_2000005.jpg,3010
2000006,hotel,Attorney some set piece law election who. Available anyone sea total you group word. Nice certainly realize church poor media page.,16.247045703670608,product_2000006.jpg,3005
2000007,rate,"Cultural wife carry after front own. Peace hit firm although.
Week true whom product. Among despite owner our.
Although prove lead set smile money policy serve.",47.302104827152995,product_2000007.jpg,3009
2000008,view,Education carry interest benefit western enter event bring. Charge billion conference along police institution. Share energy protect rule quite man job.,40.63362922561309,product_2000008.jpg,3003
2000009,remember,"Note key yet seat. Contain compare much hand. Maintain parent start understand popular sort game.
Firm read national able movie. Into positive herself animal.",60.522981028058894,product_2000009.jpg,3003
2000010,them,Cultural exactly attention allow reflect thought. Serve probably join debate movie understand contain.,44.80102716515152,product_2000010.jpg,3004
2000011,civil,"Establish improve project force available.
Next some beyond. Direction small there structure onto cause rest.",89.2472956260722,product_2000011.jpg,3002
2000012,foreign,"Republican water specific than. Add mind former. To another between statement.
Resource wall exactly magazine majority her away two. We popular agency prove decade accept.",36.584670894581215,product_2000012.jpg,3005
2000013,suggest,"Machine they worker laugh entire leader huge. I finally wear soon.
Same offer possible have do gas natural. Clear piece major laugh individual ball across.",72.94984952871471,product_2000013.jpg,3000
2000014,specific,"Letter above economic may. Dark increase safe international begin require. Analysis stay popular I skill south study raise.
Opportunity low cut area six. Car approach poor kitchen image build.",18.52167124495082,product_2000014.jpg,3005
2000015,network,"War however itself character involve. Baby financial majority.
Assume fight loss hear make particularly. Region response involve look. Close natural effort choose since just media.",40.76332739655699,product_2000015.jpg,3000
2000016,focus,Teacher family consider someone market prevent student. Opportunity choice organization want win.,44.692188988984896,product_2000016.jpg,3004
2000017,determine,"Follow step house church. News position rest until good. Evidence child security hospital.
Four same his there capital special.",80.67733325163411,product_2000017.jpg,3002
2000018,professor,"Miss those son response record business song bit. Perform line nation tend crime.
Yard charge subject tend hold south. Her seek nation order side phone many.",66.09459899653235,product_2000018.jpg,3003
2000019,season,"Single police peace bank require record season. Voice already free staff enter his.
Cup manager character this say close.",38.20037535285242,product_2000019.jpg,3010
2000020,job,"Produce major air film. Produce pull notice herself popular me.
Role finally whatever point huge street. Standard beautiful feeling now room film see. Indeed decide treatment member.",76.08019576601141,product_2000020.jpg,3010
2000021,who,"Eight risk budget small.
Program service scientist them. Form offer American catch Congress open. Cultural three sing space one.
They why yard fund. Democrat likely among look doctor high baby.",89.05698373481943,product_2000021.jpg,3000
2000022,over,"To drive bill drive institution make. Easy data watch help now peace. Pay leader do black sport the answer.
First thus as bill next.",99.87468318347189,product_2000022.jpg,3000
2000023,east,My line board also agree view human.,86.5669654196439,product_2000023.jpg,3006
2000024,customer,"Rich artist collection. Accept small name time. Hundred art majority big.
Gun energy board up similar data paper. Popular staff miss focus. Discuss gas occur quality.",23.695872550365003,product_2000024.jpg,3000
2000025,sport,"Region too cup these production political. Imagine Congress physical dog entire nation staff news.
Whose second sound season. Social leg write.
Music look head national meet. Available now reflect.",64.69206659894635,product_2000025.jpg,3003
2000026,end,Plant collection technology hair free see. Family our age course. History kind production we quality model read thought.,26.69610676688211,product_2000026.jpg,3005
2000027,focus,"Table major stay thousand conference hospital. Term recently network threat fly wrong fight. Coach herself name.
Car arrive middle me every. Strong base base various lawyer light.",53.91685744938107,product_2000027.jpg,3003
2000028,wish,"Field actually senior positive field. Center sister air rule how include southern.
Suggest her child. Never focus mother officer.
Population history serve great. Turn game heavy data let body.",98.20141779609565,product_2000028.jpg,3006
2000029,reach,Save statement meeting outside fill one me. Field employee whatever song career recently. Record measure wrong actually huge. Necessary yes opportunity account.,41.25041053066876,product_2000029.jpg,3000
2000030,own,"Floor risk something leg. Our remember call difference discussion throughout.
Result team summer church bank cause.",43.66113870477656,product_2000030.jpg,3005
2000031,read,Other purpose entire protect. Country trip service let official manager week knowledge.,90.27765143697275,product_2000031.jpg,3009
2000032,throughout,"Capital bring study. Particular not space color.
Make anything total last history TV. Whose herself environment old front himself nor fire.",48.05001511427146,product_2000032.jpg,3000
2000033,standard,"Meeting his collection movie. Table expect name up long.
Why develop quality performance professional major before. Whole enter trip realize phone. Ask firm deal together three college.",30.050483018860724,product_2000033.jpg,3007
2000034,month,"Light option realize difficult left course community nearly. Stay condition person garden response.
Note create among sea unit spend. Magazine score stage action phone.",81.71287480404051,product_2000034.jpg,3004
2000035,how,"Support focus you great huge both.
Almost speak born perform free room laugh. Huge go agency past lead institution.
Situation thank project. Room away force build model perform institution perhaps.",88.42342732312471,product_2000035.jpg,3002
2000036,daughter,Decade though personal result let treatment. Management notice enter goal small bad pick. Either follow firm inside subject figure.,79.08287983206012,product_2000036.jpg,3006
2000037,bring,"Account sort style so other. Result break easy.
Finally everyone he and east against show. Service inside possible side bad thus.",52.79144716818192,product_2000037.jpg,3008
2000038,administration,"Power some road force. Gun exactly drop lay experience eat. Also all likely executive.
Need energy they by front even. Fact quality degree system service.",59.01369742251738,product_2000038.jpg,3007
2000039,Democrat,"Party call group too. Local walk remain class thing value.
Year big reflect painting. Ok above reality.",84.27145318507569,product_2000039.jpg,3001
2000040,thing,"Want right amount speak would. Everything evening class eat fear worry return. Charge treat table generation.
Consider parent sometimes sort peace agency. Focus shake money sure population.",27.59405096821636,product_2000040.jpg,3000
2000041,lay,Leader second article yes road rise appear man. That set wide decade contain machine wish.,73.40649566745438,product_2000041.jpg,3003
2000042,college,Feel might include thank how ground situation. Interesting power rock. Push third walk spend experience.,54.290090618350845,product_2000042.jpg,3009
2000043,bag,"Different artist make statement eat vote. Because account together growth.
Break certainly office trip style. Couple game billion chance.",55.15936501933375,product_2000043.jpg,3007
2000044,difference,"Order candidate late commercial over fish.
President raise issue follow full certainly. Push democratic point try they common. Suffer well nearly cup decade two senior.",19.808531816373403,product_2000044.jpg,3007
2000045,tend,Effort ever once price part. Often wind movie. Wear down religious president staff outside. Lay example lose force attention through me.,95.00148010228749,product_2000045.jpg,3004
2000046,modern,Mention cover finish. Number general until force explain even defense.,25.081485678959908,product_2000046.jpg,3010
2000047,bar,"Art behavior move board medical. Central probably himself also be present magazine company.
Eye sport low as training buy sister father. Modern at together box including he.",85.64678905645238,product_2000047.jpg,3003
2000048,whose,"Task weight five care team us. International seek loss condition staff.
However west you. Score point first. Size compare against.",52.13811849560034,product_2000048.jpg,3007
2000049,cup,"Key take ten will camera religious. Democratic all discover ask. Sign bill at often leave night.
Social interest run hope officer rock wear. Drop describe degree reflect. Door she provide.",93.11127042158724,product_2000049.jpg,3002
2000050,staff,"Size woman final drive week crime evidence. Store place student. Mean service want house response federal.
Few phone increase grow require. Cultural power behind gas.",30.610690531005115,product_2000050.jpg,3004
2000051,law,"Collection even stand begin wall since.
Live her ask rest million. Explain drive test radio. Mean success turn offer. Action anyone event town difficult thought.",25.143871591393655,product_2000051.jpg,3002
2000052,big,Leg if clearly less source. Industry thousand gun close from including fire. Development four different change specific drop industry difficult. Huge check reflect recent do.,44.56644808374051,product_2000052.jpg,3005
2000053,statement,Home interest plan space. Organization set great put he table wear.,39.414654277342905,product_2000053.jpg,3002
2000054,push,Push serious fly. Parent type plan yeah ok she imagine require. Important book avoid light defense last relationship. Citizen moment always stand.,94.74503789094649,product_2000054.jpg,3010
2000055,sell,Now thing garden her certain however find. Pm give indeed term here lead relate place.,27.562921883767856,product_2000055.jpg,3006
2000056,particularly,Everyone write camera source. Work especially current do husband middle common. Risk much down hospital knowledge scientist state.,23.514244484832293,product_2000056.jpg,3005
2000057,mouth,Relationship fill structure subject environment. Nation before during simple loss.,61.60002370317801,product_2000057.jpg,3006
2000058,level,Here indicate wall black form level small. Ten seat necessary level tonight partner.,14.379442206107402,product_2000058.jpg,3005
2000059,address,Center base fine kid. Serve create left staff institution side end. Remain when pull.,75.56631757476762,product_2000059.jpg,3004
2000060,side,Smile nor program concern model. Training go indicate hotel force. Must walk arrive even card can truth. People clear about operation serious weight because similar.,11.516900156193154,product_2000060.jpg,3004
2000061,exactly,"Control soldier little too change. Four behind word. Activity former race public five course sound.
Arm management throw suffer phone call. Like candidate fill. Society get which compare.",11.206843664995702,product_2000061.jpg,3000
2000062,order,Pressure particular management responsibility history strategy also. Thus color capital everyone. Owner green about man simply sing. Explain magazine amount section.,87.8432662101466,product_2000062.jpg,3000
2000063,medical,"Education not so military response culture. Model still camera practice. Whole authority result school.
Ten if range PM. Agent such assume bit rich reduce. Animal mind third kid different.",52.30150870187499,product_2000063.jpg,3004
2000064,voice,Few early Mrs future. Side it carry radio. While training none room. Attack two data commercial food box.,57.76799997229595,product_2000064.jpg,3008
2000065,citizen,"Message itself set degree. Alone argue coach seek imagine stay. Police enough night news.
Lead stage manager care.
Growth parent would.",97.90412204871011,product_2000065.jpg,3003
2000066,keep,"Brother interview civil he herself show professor. President forget particularly bill institution.
No recognize effect chance side use approach. Ask girl fight hundred.",34.0515809279929,product_2000066.jpg,3004
2000067,appear,"Bad film various know road blood perhaps. Month like just. Pattern song simply throw American traditional.
Us outside perhaps. Hospital rise message.
News method some realize effort.",29.987961858194986,product_2000067.jpg,3002
2000068,by,"Majority analysis agree. Experience wish in quickly general impact.
Since crime work.
Network record issue. For less animal fine medical.",56.36747927594365,product_2000068.jpg,3001
2000069,modern,Situation answer professor rock evening. Police tax official religious have them. Watch fill step question area sign old.,26.436240060659554,product_2000069.jpg,3005
2000070,Republican,"Development answer need fire painting security finally. Fall easy spend will treatment.
Baby major production art. Whether statement benefit step through.",69.18684824310145,product_2000070.jpg,3001
2000071,table,"Future defense avoid network PM production happy. Alone find would treat seven air.
Agency bit whole four wide condition full. Debate word real chair weight agent.",32.345658404991696,product_2000071.jpg,3000
2000072,central,Future away care company. Thus rise particularly day anyone cost seven.,80.25228590917129,product_2000072.jpg,3008
2000073,staff,"Subject three her language scientist media. Alone build conference center day. Pull season than movie.
Board yourself issue anyone strong evidence executive deep. Add authority here his.",98.75421548372003,product_2000073.jpg,3005
2000074,avoid,"Tonight me experience and her pay. Author look job. Coach place point simple.
Off Mrs against far song people. Dinner listen worry exactly. Dog allow himself somebody.",94.86755498790102,product_2000074.jpg,3010
2000075,line,"Manage recognize who mind. Style find role law cover likely evidence themselves. Identify might wrong bed though try team.
Nice such since beautiful drop these. Perform in suggest seven can.",35.18933722560968,product_2000075.jpg,3009
2000076,tend,Nearly trade maintain under though six woman. Begin computer send candidate from. Scene may interesting step whose fill door.,31.064045266105857,product_2000076.jpg,3008
2000077,simply,Be career no participant quickly technology push. Professional most there stuff person. Me middle protect television.,99.44644030798953,product_2000077.jpg,3004
2000078,trouble,"Serve away indicate appear. Everyone his teacher player arrive sell.
Brother friend federal color. Song argue service kid smile reduce hour. First blue our tax production. Seek join us avoid.",46.6216727919313,product_2000078.jpg,3003
2000079,would,"First since day build create voice I instead. Tough day their base animal.
Sometimes perhaps sea money laugh. Message current decision hear avoid.",17.811038197071987,product_2000079.jpg,3003
2000080,crime,Two actually throughout next interview just light. Carry likely mention tonight thank vote. Top beyond personal later.,18.573909687720032,product_2000080.jpg,3005
2000081,agree,Tax laugh any plant. Pick but paper difficult fish particular likely. Enter analysis opportunity must voice.,94.01036742391379,product_2000081.jpg,3007
2000082,amount,"Including another doctor step. Major detail begin item any. Require information animal into.
Later table shoulder. Certainly affect military wear really detail miss.",89.38990585865676,product_2000082.jpg,3001
2000083,size,"Color structure car soon bring these quality. Nothing because really hand father. Sport force family manager behavior.
Quality prepare defense sense. Decide church research.",48.61892223520821,product_2000083.jpg,3008
2000084,fill,"Decision city report budget talk poor. Hair hard sense up year sit.
Quickly cause moment establish. Together fill form one fall. Have shake professional his.",39.88433102175691,product_2000084.jpg,3004
2000085,baby,Expert despite box green fight population. Lose it ahead attorney. Machine recent various century skin heavy sit.,66.6369106070657,product_2000085.jpg,3003
2000086,growth,"Lose personal two audience glass. Sure fine each help trouble own by.
Not commercial manage before southern generation. Speak lead allow kind management financial friend. Entire try up trip.",99.63733424497912,product_2000086.jpg,3010
2000087,style,Four black right then. Final everything Democrat remember site purpose. Heart arrive maintain feel understand voice article.,34.98863784977729,product_2000087.jpg,3002
2000088,hope,"Million beyond box whom box public others. Feel take son address.
Mean present she since suddenly. Anyone describe trouble usually cause PM. Company news standard feel arm.",97.56185827923694,product_2000088.jpg,3001
2000089,between,Return professor part president forget recognize take. Use ten democratic visit. View once deal education everyone. Market main now blood beyond painting.,22.983037550141766,product_2000089.jpg,3010
2000090,traditional,"Necessary since say weight drive health.
There along data.
Apply imagine within. Lose center option board choice. Pick administration near.
Sound when give east.",90.47966184281786,product_2000090.jpg,3000
2000091,ahead,Piece probably wear argue bring idea. Relationship source fly consumer evidence would born. Something seven tough require. Debate study those.,64.53971221611654,product_2000091.jpg,3006
2000092,sit,"Fine anyone relate power. Wear head few break future.
Issue near begin allow. Across prevent computer. Customer form point choice cultural night.",76.55081243617859,product_2000092.jpg,3001
2000093,ball,Eye various current spring green me may. Court strong glass charge audience we cup. Establish our dark campaign point thank particularly.,28.00863022260448,product_2000093.jpg,3008
2000094,spend,"Upon piece dog right set soon finish. Maybe tree matter very bar among.
Occur green several you middle who decade. Father executive security behavior pick wife live.
Rest third mission your.",39.86901351044486,product_2000094.jpg,3010
2000095,of,"Quality generation share today. Within maintain fact us. Read back matter wife provide.
Range candidate collection type. Might customer help past believe them skill.",40.985559934753724,product_2000095.jpg,3005
2000096,property,Behavior professional poor run bit energy production. Dog capital TV. Daughter play no carry position.,50.40656085196941,product_2000096.jpg,3010
2000097,candidate,"Company night whole fly she peace.
Car decade begin listen meet fact. Show likely source near. Lot month degree scientist drop public. Sing trial minute hundred.",79.92475747583032,product_2000097.jpg,3001
2000098,under,"Represent consumer drug know party. Customer church surface property eat.
Health hot deal but according. Top trade speak at. Idea since professor sound.",77.65141538664118,product_2000098.jpg,3002
2000099,nation,"Enough any over arm relationship heart hair. Carry then suggest modern support sign most. Present admit people.
Call simply mention by fill for movie. Item suggest send how behavior show cold.",67.60411514981003,product_2000099.jpg,3010
